nome,apelido,cidade,telefone_principal,email,logradouro,tags
EVERTON JUNIOR NIPPES,EVERTON JUNIOR NIPPES,COLATINA,+5527998131746,,CÓRREGO SANTA CATARINA - PAUL,"cafe_conilon, pos_colheita_conilon_2026, produtor_grande, tem_secador, usa_custeio_anual, usa_investimento"
CLEBER MAGNAGO,CLEBER MAGNAGO,MARILÂNDIA,+5527997887585,,CÓRREGO PATRAO MOR,"pos_colheita_conilon_2026, usa_custeio_anual, usa_investimento"
RICARDO CALIMAN GOTARDO,RICARDO CALIMAN GOTARDO RCGOTARDO@HOTMAIL.COM,MARILÂNDIA,+5527998247561,,ESTRADA MARILANDIA- SÃO PEDRO,"pos_colheita_conilon_2026, usa_custeio_anual, usa_investimento"
ADEMAR LUIZ PIANA JUNIOR,ADEMAR LUIZ PIANA JUNIOR,MARILÂNDIA,+5527999071000,ademarpiana@gmail.com,CÓRREGO SANTA LUZIA,"pos_colheita_conilon_2026, produtor_grande"
JULIO CEZAR ALTOE,JULIO CEZAR ALTOE,MARILÂNDIA,+5527999008790,francielyaltoe@hotmail.com,CÓRREGO SUMIDOURO,"pos_colheita_conilon_2026, produtor_grande"
ZENOBIO ARDICON BRAGA,ZENOBIO ARDICON BRAGA,LINHARES,+5527998565153,lenymariabraga@gmail.com,ESTRADA BARRA DO RIO SÃO RAFAEL,"pos_colheita_conilon_2026, produtor_grande"
